<?xml version="1.0" encoding="UTF-8"?>
<website xmlns:xsi="http://www.w3.org/2001/XMLSchema-instance" xsi:noNamespaceSchemaLocation="WebpageStructure.xsd">
	<content>
    	<tag>div</tag>
    	<type>class</type>
    	<value>content_text</value>
  	</content>
  	<footer>
  		<tag>div</tag>
  		<type>id</type>
  		<value>footer</value>
  	</footer>
  	<header>
  		<tag>div</tag>
  		<type>id</type>
  		<value>top</value>
  	</header>
  	<logo>
  		<tag>div</tag>
  		<type>class</type>
  		<value>logo</value>
  	</logo>
	<menuLeft>
		<tag>div</tag>
  		<type>id</type>
  		<value>content_left</value>
	</menuLeft>
	<menuLeftHeading>
		<tag>div</tag>
  		<type>class</type>
  		<value>box_nadpis</value>
	</menuLeftHeading>	
	<menuLeftItems>
		<tag>div</tag>
		<type>class</type>
		<value>box</value>
	</menuLeftItems>
	<menuRight>
		<tag>div</tag>
		<type>id</type>
		<value>content_right</value>
	</menuRight>
	<menuRightHeading>
		<tag>div</tag>
  		<type>class</type>
  		<value>box_nadpis</value>
	</menuRightHeading>
	<menuRightItems>
		<tag>div</tag>
		<type>class</type>
		<value>box</value>
	</menuRightItems>
	<menuTop>
		<tag>div</tag>
  		<type>class</type>
  		<value>top_menu</value>
	</menuTop>	
	<news>
	 	<tag>div</tag>
	 	<type>class</type>
	 	<value>news_annotation</value>
	 </news>
	<print>
		<tag>div</tag>
		<type>class</type>
		<value>print_button</value>
	</print>
	<search>
		<tag>div</tag>
		<type>class</type>
		<value>box_search</value>
	</search> 
</website>
